{"schemaVersion":1,"researchDate":"2026-10-20","artifactType":"review_ready_capability_metadata_not_runtime_configuration","baseline":{"repository":"sorensadrgit-art/Soren-MCP_1","ref":"cf851014c6aff9d51f967d18ea9cc2b950c6bb7f","evidenceScope":"source_inspection","liveRuntimeProbedThisTurn":false,"endpoint":"https://soren-shared-mcp-skills.vercel.app/api/mcp"},"domains":{"assistance":"General AI Agent Assistance","research":"Web Scraping and Research","data":"Data Analysis and Processing","development":"Software Development and Coding","automation":"Workflow Automation and Orchestration"},"sharedPolicy":{"catalogInclusionGrantsPermission":false,"automaticInstall":false,"automaticExecution":false,"externalContentApproval":"REQUIRES_EXACT_REVISION_REVIEW","sourceDocumentationStatus":"REVIEWED_AS_OF_RESEARCH_DATE","targetClientConnectionStatus":"NOT_PROBED","secretValuesStored":false,"recommendedSelection":"one primary capability plus at most two complementary capabilities per step, unless explicit task coverage requires more","publisherIdentityIsNotApproval":true,"licensePolicy":"Verify license and notices of each selected revision/file and runtime separately before copying or redistribution. This catalog copies no third-party instruction bodies.","priorityMeaning":{"P0":"preserve existing contract","P1":"recommended next catalog/connection pilot","P2":"conditional; only when workload/runtime requires it"}},"records":[{"id":"core.accessibility","kind":"bundled_skill","domains":["development"],"name":"Accessibility","capabilities":["ui.accessibility","ui.keyboard","ui.review"],"useWhen":"Audit interface semantics, focus, keyboard and accessible interactions.","avoidWhen":"Do not treat instruction text as a completed accessibility audit.","delivery":"existing_read_skill","effects":["guidance_only"],"requires":[],"sourceIds":["S00"],"constraints":"Bundled instruction source retained; no new conformance claim.","inventoryState":"existing_in_inspected_source","priority":"P0","alternatives":[],"targetAvailability":"NOT_PROBED","selectedArtifactRevision":null,"selectedArtifactSha256":null,"executionAuthorized":false},{"id":"core.motion-systems","kind":"bundled_skill","domains":["development"],"name":"Motion systems","capabilities":["ui.motion","ui.webgl","ui.performance"],"useWhen":"Plan cinematic motion and WebGL systems.","avoidWhen":"Do not impose 3D or GSAP when the user selected another approach.","delivery":"existing_read_skill","effects":["guidance_only"],"requires":[],"sourceIds":["S00"],"constraints":"Retain original name and resource URI.","inventoryState":"existing_in_inspected_source","priority":"P0","alternatives":[],"targetAvailability":"NOT_PROBED","selectedArtifactRevision":null,"selectedArtifactSha256":null,"executionAuthorized":false},{"id":"core.mcp-integration","kind":"bundled_skill","domains":["assistance","development"],"name":"MCP integration","capabilities":["mcp.connect","mcp.verify","mcp.design"],"useWhen":"Configure and verify supported remote MCP connections.","avoidWhen":"Do not infer named-client invocation from a saved URL.","delivery":"existing_read_skill","effects":["guidance_only"],"requires":[],"sourceIds":["S00"],"constraints":"Instructions do not grant network/account permissions.","inventoryState":"existing_in_inspected_source","priority":"P0","alternatives":[],"targetAvailability":"NOT_PROBED","selectedArtifactRevision":null,"selectedArtifactSha256":null,"executionAuthorized":false},{"id":"core.skill-orchestration","kind":"bundled_skill","domains":["assistance","automation"],"name":"Skill orchestration","capabilities":["skills.select","context.scope"],"useWhen":"Select complementary instructions with progressive loading.","avoidWhen":"Do not recursively route trivial work or manage another agent.","delivery":"existing_read_skill","effects":["guidance_only"],"requires":[],"sourceIds":["S00"],"constraints":"Routing advice is subordinate to host instructions.","inventoryState":"existing_in_inspected_source","priority":"P0","alternatives":[],"targetAvailability":"NOT_PROBED","selectedArtifactRevision":null,"selectedArtifactSha256":null,"executionAuthorized":false},{"id":"catalog.skills-sh","kind":"discovery_catalog","domains":["assistance","development"],"name":"Skills.sh","capabilities":["skills.discover","skills.inspect"],"useWhen":"Search external skill metadata and available files/audits.","avoidWhen":"Do not infer approval from an audit or account authority from discovery.","delivery":"existing_provider_adapter","effects":["network_read"],"requires":["authorized server-side OIDC where required"],"sourceIds":["S03"],"constraints":"Version and review individual assets; never log OIDC tokens.","inventoryState":"existing_in_inspected_source","priority":"P0","alternatives":[],"targetAvailability":"NOT_PROBED","selectedArtifactRevision":null,"selectedArtifactSha256":null,"executionAuthorized":false},{"id":"catalog.skillsmp","kind":"discovery_catalog","domains":["assistance","development"],"name":"SkillsMP","capabilities":["skills.discover","skills.inspect"],"useWhen":"Search community skill records using current documented quotas.","avoidWhen":"Do not retry through another account or endpoint to bypass denial/quota.","delivery":"existing_provider_adapter","effects":["network_read"],"requires":["anonymous trial or authorized optional account credential"],"sourceIds":["S04"],"constraints":"Current docs permit an account Bearer key sharing REST allowance; prior blanket no-auth assumptions must be rechecked.","inventoryState":"existing_in_inspected_source","priority":"P0","alternatives":[],"targetAvailability":"NOT_PROBED","selectedArtifactRevision":null,"selectedArtifactSha256":null,"executionAuthorized":false},{"id":"collection.anthropic","kind":"skill_collection","domains":["assistance","development"],"name":"Anthropic Skills","capabilities":["skills.discover","documents.guidance","mcp.design"],"useWhen":"Select a relevant first-party instruction package.","avoidWhen":"Do not treat all repository files as approved or copy all at startup.","delivery":"existing_provider_adapter","effects":["network_read","may_bundle_code"],"requires":["exact path/revision/license review before adoption"],"sourceIds":["S05"],"constraints":"Existing provider discovery does not make all upstream skills bundled.","inventoryState":"existing_in_inspected_source","priority":"P0","alternatives":[],"targetAvailability":"NOT_PROBED","selectedArtifactRevision":null,"selectedArtifactSha256":null,"executionAuthorized":false},{"id":"catalog.mcp-registry","kind":"discovery_catalog","domains":["assistance","development"],"name":"Official MCP Registry","capabilities":["mcp.discover"],"useWhen":"Find server identity/transport/package metadata.","avoidWhen":"Do not treat registry status or a similar name as publisher authenticity or safety approval.","delivery":"existing_provider_adapter","effects":["network_read"],"requires":[],"sourceIds":["S06"],"constraints":"HAPI was a discovery interface in this research; do not duplicate the registry under a second authority.","inventoryState":"existing_in_inspected_source","priority":"P0","alternatives":[],"targetAvailability":"NOT_PROBED","selectedArtifactRevision":null,"selectedArtifactSha256":null,"executionAuthorized":false},{"id":"collection.vercel","kind":"skill_collection","domains":["development"],"name":"Vercel Agent Skills","capabilities":["react.performance","ui.review","vercel.optimization"],"useWhen":"Use specific React/Next.js/UI guidance appropriate to the installed stack.","avoidWhen":"Do not replace current project conventions or import deployment scripts implicitly.","delivery":"source_selection","effects":["guidance_only","may_bundle_code"],"requires":["review selected skill path, commit, assets and license"],"sourceIds":["S07"],"constraints":"Select react-best-practices or web-design-guidelines by task, not the whole repository.","inventoryState":"research_candidate","priority":"P1","alternatives":[],"targetAvailability":"NOT_PROBED","selectedArtifactRevision":null,"selectedArtifactSha256":null,"executionAuthorized":false},{"id":"collection.supabase","kind":"skill_collection","domains":["data","development"],"name":"Supabase Agent Skills","capabilities":["postgres.design","postgres.performance","postgres.rls"],"useWhen":"Review SQL, indexes, schema and Supabase integrations.","avoidWhen":"Do not run database migrations or grant admin access from a recommendation.","delivery":"source_selection","effects":["guidance_only","may_bundle_code"],"requires":["review exact skill revision; separately authorized DB connection for actions"],"sourceIds":["S08"],"constraints":"Start with postgres best practices for SQL tasks; comprehensive Supabase skill only when relevant.","inventoryState":"research_candidate","priority":"P1","alternatives":[],"targetAvailability":"NOT_PROBED","selectedArtifactRevision":null,"selectedArtifactSha256":null,"executionAuthorized":false},{"id":"collection.microsoft","kind":"skill_collection","domains":["assistance","development"],"name":"Microsoft Skills","capabilities":["azure.sdk","foundry.guidance","mcp.design"],"useWhen":"Use an Azure/Foundry/language-specific skill for an actual matching stack.","avoidWhen":"Do not use as a universal default or import repository-wide AGENTS templates.","delivery":"source_selection","effects":["guidance_only","may_bundle_code"],"requires":["select exact SDK/language/version and review assets"],"sourceIds":["S09"],"constraints":"This is a mixed collection; classify an individual selected entry again.","inventoryState":"research_candidate","priority":"P2","alternatives":[],"targetAvailability":"NOT_PROBED","selectedArtifactRevision":null,"selectedArtifactSha256":null,"executionAuthorized":false},{"id":"collection.firecrawl","kind":"skill_collection","domains":["research","development"],"name":"Firecrawl Skills","capabilities":["web.research-guidance","web.api-integration","web.workflow-guidance"],"useWhen":"Ch